{
  "contract_version": "1.0.0",
  "request_id": "req-syn-0001",
  "journey_id": "journey-syn-0001",
  "decision_time": "2026-01-01T09:15:00Z",
  "task": "CLINICAL_FRONT_DOOR",
  "evidence": [
    {
      "evidence_id": "ev-001",
      "event_type": "CHIEF_COMPLAINT",
      "modality": "TEXT",
      "available_at_time": "2026-01-01T09:00:00Z",
      "data_classification": "SYNTHETIC",
      "payload_ref": "synthetic://journey-syn-0001/ev-001"
    },
    {
      "evidence_id": "ev-002",
      "event_type": "VITAL",
      "modality": "STRUCTURED",
      "available_at_time": "2026-01-01T09:12:00Z",
      "data_classification": "SYNTHETIC",
      "payload_ref": "synthetic://journey-syn-0001/ev-002"
    }
  ],
  "missing_information": ["ECG", "additional symptom characteristics"],
  "requested_outputs": ["URGENCY", "RED_FLAGS", "CARE_PATHWAYS", "NEXT_INFORMATION", "UNCERTAINTY", "GRAPH"],
  "authorization": {
    "data_classification": "SYNTHETIC",
    "external_provider_allowed": true,
    "approval_id": null
  },
  "provider_constraints": {
    "timeout_ms": 10000,
    "max_output_tokens": 1024,
    "cost_class": "FREE_LOCAL",
    "deterministic_preferred": true
  }
}

